{"$schema":"https://json-schema.org/draft/2020-12/schema","$id":"https://socioprophet.org/contracts/LinkabilityScope.v0.1.json","title":"LinkabilityScope","type":"object","additionalProperties":false,"required":["version","scope_id","created_at","scope_type","scope_ref","linkability_policy","trace_open_authority"],"properties":{"version":{"const":"0.1"},"scope_id":{"type":"string","minLength":8},"created_at":{"type":"string","format":"date-time"},"scope_type":{"type":"string","enum":["guild","subguild","topic","service_role","appeal_case"]},"scope_ref":{"type":"string","minLength":3},"linkability_policy":{"type":"string","enum":["public_within_scope","auditor_only","constitutional_review_only"]},"revocation_supported":{"type":"boolean"},"verifier_local_revocation_supported":{"type":"boolean"},"trace_open_authority":{"type":"object","additionalProperties":false,"required":["authority_ref","trigger_policy_ref"],"properties":{"authority_ref":{"type":"string","minLength":3},"trigger_policy_ref":{"type":"string","minLength":3}}}}}